{"domain":"FRAUD","effectiveFrom":"2026-01-01T00:00:00Z","effectiveUntil":"2027-01-01T00:00:00Z","id":"fraud.count-shadow","purpose":"synthetic-review","reasons":{"hash":"faa82871beb4f12d856ee6865781b64da996c05d14cdd1fbeb5d8b10a67391c6","id":"fraud.reasons","revision":1},"revision":1,"rules":[{"effect":{"type":"FRAUD_ASSESSMENT","verdict":"REVIEW"},"feature":{"hash":"aaaaaaaaaaaaaaaaaaaaaaaaaaaaaaaaaaaaaaaaaaaaaaaaaaaaaaaaaaaaaaaa","id":"velocity_txn_count_h1","revision":1},"id":"velocity","maxAgeSeconds":"60","minimum":"10","operator":"COUNT_AT_LEAST","reason":"BURST"}],"schemaVersion":1,"severities":null}
